rethinking ai strategy and policy as entangled super wicked problems	paper attempts preliminary analysis general approach ai strategy/policy research lens wicked problems literature wicked problems class social policy problems traditional methods resolution fail super wicked problems refer even complex social policy problems e.g climate change first propose hierarchy three classes ai strategy/policy problems wicked super wicked problems next identify three independent super wicked problems ai strategy/policy propose significant challenges development safe beneficial artificial general intelligence significantly complex nuanced thus posing new degree 'wickedness explore analysis techniques addressing wicked problems super wicked problems leads discussion implications ideas problems ai strategy/policy	positive	0
fairness in deceased organ matching	algorithms given responsibility make decisions impact lives increasing awareness need ensure fairness decisions one first challenges decide fairness means particular context consider fairness deciding match organs donated deceased donors patients due increasing age patients waiting list organs donated current `` first come first served '' mechanism used australia review take account age patients organs consider revise mechanism take account age fairly identify number different types fairness patients regions blood types consider achieved	positive	0
using education as a model to capture good-faith effort for autonomous systems	multiprocess environments comprising several intercommunicating lisp systems straightforward implement due certain fundamental characteristics lisp language experiences four methods establishing necessary communications linkages described features lisp support experimentation interprocess communication identified two key characteristics language important regard 1. lisp programs construct interpret new code run 2. structures within lisp systems accessible name flexible communication methods use ordinary lisp input output functions supplemented small amount system-dependent code create communication linkages treated lisp file structures	positive	0
speaking on behalf of: representation, delegation, and authority in computational text analysis	computational tools often facilitate human work rapidly summarizing large amounts data especially text delegates models measure authority speak behalf people whose data analyzed paper considers consequences delegation draws sociological accounts representation translation examine one particular case application topic modeling blogs written parents children autism spectrum paper illustrates kinds statements topic models computational techniques make behalf people also articulates potential consequences statements paper concludes offering several suggestions address potential harms occur computational models speak behalf someone	positive	0
ai + art = human	past years specialised online offline press blossomed articles art made `` '' artificial intelligence ai narrative rapidly changing fact october 2018 auction house christie 's sold art piece allegedly made `` '' ai draw philosophy art science arguing ai technical object always intertwined human nature despite level autonomy however use creative autonomous agents cultural social implications way experience art creators well audience therefore highlight importance interdisciplinary dialogue promoting culture transparency technology used awareness meaning technology society value creativity lives	positive	0
the role and limits of principles in ai ethics: towards a focus on tensions	last years seen proliferation principles ai ethics substantial overlap different sets principles widespread agreement ai used common good used harm people undermine rights respect widely held values fairness privacy autonomy articulating agreeing principles important starting point drawing comparisons field bioethics highlight limitations principles particular often broad high-level guide ethics practice suggest important next step field ai ethics focus exploring tensions inevitably arise try implement principles practice explicitly recognising tensions begin make decisions resolved specific cases develop frameworks guidelines ai ethics rigorous practically relevant discuss different specific ways tensions arise ai ethics processes might needed resolve	positive	0
degenerate feedback loops in recommender systems	machine learning used extensively recommender systems deployed products decisions made systems influence user beliefs preferences turn affect feedback learning system receives thus creating feedback loop phenomenon give rise so-called `` echo chambers '' `` filter bubbles '' user societal implications paper provide novel theoretical analysis examines role user dynamics behavior recommender systems disentangling echo chamber filter bubble effect addition offer practical solutions slow system degeneracy study contributes toward understanding developing solutions commonly cited issues complex temporal scenario area still largely unexplored	positive	0
meta-descent for online, continual prediction	paper investigates different vector step-size adaptation approaches non-stationary online continual prediction problems vanilla stochastic gradient descent considerably improved scaling update vector appropriately chosen step-sizes many methods including adagrad rmsprop amsgrad keep statistics learning process approximate second order update—a vector approximation inverse hessian another family approaches use meta-gradient descent adapt stepsize parameters minimize prediction error metadescent strategies promising non-stationary problems extensively explored quasi-second order methods first derive general incremental metadescent algorithm called adagain designed applicable much broader range algorithms including semi-gradient updates even accelerations rmsprop provide empirical comparison methods families conclude methods families perform well non-stationary prediction problems meta-descent methods exhibit advantages method particularly robust across several prediction problems competitive state-of-the-art method large-scale time-series prediction problem real data mobile robot	negative	6.436323330693995
compensation at the crossroads: autonomous vehicles and alternative victim compensation schemes	last five years small growing number vehicle accidents involving fully partially autonomous vehicles raised new profoundly novel legal issue liable anyone victims compensated vehicle controlled algorithm rather human driver causes injury answer question implications far beyond resolution individual autonomous vehicle crash cases whether american legal system capable handling cases fairly efficiently implicates likelihood consumers adopt autonomous vehicles b rate implications concern law policy makers immensely autonomous cars stand drastically reduce number fatalities injuries u.s. roadways-and virtually every scholar believes will-getting adjudication compensation aspect autonomous vehicle injuries `` wrong '' speak risks stymieing adoption technology leaving americans risk dying hands human drivers	positive	0
hypergraph optimization for multi-structural geometric model fitting	recently hypergraph-based methods proposed deal problem model fitting computer vision mainly due superior capability hypergraph represent complex relationship data points however hypergraph becomes extremely complicated input data include large number data points usually contaminated noises outliers significantly increase computational burden order overcome problem propose novel hypergraph optimization based model fitting homf method construct simple effective hypergraph specifically homf includes two main parts adaptive inlier estimation algorithm vertex optimization iterative hyperedge optimization algorithm hyperedge optimization proposed method highly efficient obtain accurate model fitting results within iterations moreover homf directly apply spectral clustering achieve good fitting performance extensive experimental results show homf outperforms several state-of-the-art model fitting methods synthetic data real images especially sampling efficiency handling data severe outliers	negative	5.987732458626851
 norms, rewards, and the intentional stance: comparing machine learning approaches to ethical training	challenge training ai systems perform responsibly beneficially inspired different approaches teaching system people want acceptable attain world paper compare work reinforcement learning particular inverse reinforcement learning norm inference approach test two systems present results using idea `` intentional stance '' explain norm inference approach work even another agent acting strictly according reward functions way norm inference presents promising explicitly accountable approach design ai systems start	positive	0
imli: an incremental framework for maxsat-based learning of interpretable classification rules	wide adoption machine learning critical domains medical diagnosis law education propelled need interpretable techniques due need end users understand reasoning behind decisions due learning systems computational intractability interpretable learning led practitioners design heuristic techniques fail provide sound handles tradeoff accuracy interpretability motivated success maxsat solvers past decade recently maxsat-based approach called mlic proposed seeks reduce problem learning interpretable rules expressed conjunctive normal form cnf maxsat query mlic shown achieve accuracy similar state art black-box classifiers generating small interpretable cnf formulas runtime performance mlic significantly lagging renders approach unusable practice context authors raised question possible achieve best worlds i.e. sound framework interpretable learning take advantage maxsat solvers scaling real-world instances paper take step towards answering question affirmation propose imli incremental approach maxsat based framework achieves scalable runtime performance via partition-based training methodology extensive experiments benchmarks arising uci repository demonstrate imli achieves three orders magnitude runtime improvement without loss accuracy interpretability	positive	0
mpd-al: an efficient membrane potential driven aggregate-label learning algorithm for spiking neurons	one long-standing questions biology machine learning neural networks may learn important features input activities delayed feedback commonly known temporal credit-assignment problem aggregate-label learning proposed resolve problem matching spike count neuron magnitude feedback signal however existing threshold-driven aggregate-label learning algorithms computationally intensive resulting relatively low learning efficiency hence limiting usability practical applications order address limitations propose novel membrane-potential driven aggregate-label learning algorithm namely mpd-al algorithm easiest modifiable time instant identified membrane potential traces neuron guild synaptic adaptation based presynaptic neurons ’ contribution time instant experimental results demonstrate proposed algorithm enables neurons generate desired number spikes detect useful clues embedded within unrelated spiking activities background noise better learning efficiency state-of-the-art tdp1 multi-spike tempotron algorithms furthermore propose data-driven dynamic decoding scheme practical classification tasks aggregate labels hard define scheme effectively improves classification accuracy aggregate-label learning algorithms demonstrated speech recognition task	negative	6.876931377919391
margins and opportunity	use statistical quantity margin -- distance decision boundary classified point gap two scores -- formalize principle equal opportunity -- chance improve one 's outcome regardless group status leads better definition opportunity recognizes example strongly rejected individual offered less recourse weakly rejected one despite shared outcome also leads simpler algorithms since real-valued margins easier analyze optimize discrete outcomes formalize two ways protected group may guaranteed equal opportunity 1 social mobility acceptance within reach group conversely general population n't cushioned rejection 2 contrast within group good candidates get substantially higher scores bad candidates preventing so-called 'token effect simple linear classifier seems offer roughly equal opportunity experimentally mathematically	positive	0
cgmh: constrained sentence generation by metropolis-hastings sampling	real-world applications natural language generation often constraints target sentences addition fluency naturalness requirements existing language generation techniques usually based recurrent neural networks rnns however non-trivial impose constraints rnns maintaining generation quality since rnns generate sentences sequentially beam search first word last paper propose cgmh novel approach using metropolis-hastings sampling constrained sentence generation cgmh allows complicated constraints occurrence multiple keywords target sentences handled traditional rnn-based approaches moreover cgmh works inference stage require parallel corpora training evaluate method variety tasks including keywords-to-sentence generation unsupervised sentence paraphrasing unsupervised sentence error correction cgmh achieves high performance compared previous supervised methods sentence generation code released https //github.com/ningmiao/cgmh	negative	7.247523483121768
show, attend and read: a simple and strong baseline for irregular text recognition	recognizing irregular text natural scene images challenging due large variance text appearance curvature orientation distortion existing approaches rely heavily sophisticated model designs and/or extra fine-grained annotations extent increase difficulty algorithm implementation data collection work propose easy-to-implement strong baseline irregular scene text recognition using offthe-shelf neural network components word-level annotations composed 31-layer resnet lstmbased encoder-decoder framework 2-dimensional attention module despite simplicity proposed method robust achieves state-of-the-art performance irregular text recognition benchmarks comparable results regular text datasets code released	negative	7.1264336164458655
connecting language to images: a progressive attention-guided network for simultaneous image captioning and language grounding	image captioning visual language grounding two important tasks image understanding seldom considered together paper propose progressive attention-guided network pagnet simultaneously generates image captions predicts bounding boxes caption words pagnet mainly two distinctive properties progressively refine predictive results image captioning updating attention map predicted bounding boxes ii learns bounding boxes words using weakly supervised strategy combines frameworks multiple instance learning mil markov decision process mdp using attention map generated captioning process pagnet significantly reduces search space mdp conduct experiments benchmark datasets demonstrate effectiveness pagnet results show pagnet achieves best performance	negative	6.8665067091351375
optimization of hierarchical regression model with application to optimizing multi-response regression k-ary trees	fast convenient well-known way toward regression induce prune binary tree however little attempt toward improving performance induced regression tree paper presents meta-algorithm capable minimizing regression loss function thus improving accuracy given hierarchical model k-ary regression trees proposed method minimizes loss function node one one split nodes leads solving instance-based cost-sensitive classification problem node ’ data points leaf nodes method leads simple regression problem case binary univariate multivariate regression trees computational complexity training linear samples hence method scalable large trees datasets also briefly explore possibilities applying proposed method classification tasks show algorithm significantly better test error compared state-ofthe- art tree algorithms end accuracy memory usage query time method compared recently introduced forest models depict time proposed method able achieve better similar accuracy tangibly faster query time smaller number nonzero weights	negative	8.173982021049596
triple classification using regions and fine-grained entity typing	triple knowledge-graph takes form consists head relation tail triple classification used determine truth value unknown triple hard task 1-to-n relations using vector-based embedding approach propose new region-based embedding approach using fine-grained type chains novel geometric process presented extend vectors pre-trained entities n-balls n-dimensional balls condition head balls shall contain tail balls algorithm achieves zero energy cost therefore serves case study perfectly imposing tree structures vector space unknown triple h r x predicted true x ’ n-ball located r-subspace h ’ n-ball following construction known tails h. experiments based large datasets derived benchmark datasets wn11 fb13 wn18 results show performance new method related length type chain quality pre-trained entityembeddings performances long chains welltrained entity-embeddings outperform methods literature source codes datasets located https //github.com/gnodisnait/mushroom	negative	5.126671731821261
rs3cis: robust single-step spectral clustering with intrinsic subspace	spectral clustering widely adopted mine structures data clusters clustering performance spectral clustering depends largely quality constructed affinity graph especially data noise subspace learning transform original input features low-dimensional subspace help produce robust method therefore learn intrinsic subspace construct pure affinity graph dataset noise challenge spectral clustering order deal challenge new robust single-step spectral clustering intrinsic subspace rs3cis method proposed paper rs3cis uses local representation method projects original data low-dimensional subspace row-sparse transformation matrix uses 2,1-norm transformation matrix penalty term achieve noise suppression addition rs3cis introduces laplacian matrix rank constraint output affinity graph explicit clustering structure makes final clustering result obtained single-step constructing affinity matrix one synthetic dataset six real benchmark datasets used verify performance proposed method performing clustering projection experiments experimental results show rs3cis outperforms related methods respect clustering quality robustness dimension reduction	negative	7.153405861696228
avs-net: automatic visual surveillance using relation network	visual surveillance closed circuit television cctv help prevent crime paper propose automatic visual surveillance network avs-net simultaneously performs image processing object detection determine dangers situations captured cctv addition add relation module infer relationships objects images experimental results show relation module greatly improves classification accuracy even enough information	negative	7.528892308240756
regulating lethal and harmful autonomy: drafting a protocol vi of the convention on certain conventional weapons 	short paper provides two partial drafts protocol vi might added existing five protocols convention certain conventional weapons ccw regulate `` lethal autonomous weapons systems '' laws draft sets line tolerance `` human loop '' critical functions select engage draft b sets line tolerance human `` wider loop '' includes critical function defining target classes well select engage draft represents interpretation ngos campaign stop killer robots seeking get enacted draft b cautious draft based dutch concept `` meaningful human control wider loop '' seek ban system currently exists draft may likely achieve consensus required un ccw process list weapons banned drafts provided along rationale draft drafts intended stimulate debate precise form binding instrument laws would take laws banned	positive	0
preferences and ethical principles in decision making	want people trust ai systems need provide systems create ability discriminate humans would consider good bad decisions quality decision based preferences optimization criteria decision makers also properties related impact decision whether ethical complies constraints priorities given feasibility constraints safety regulations cp-net formalism 2 convenient expressive way model preferences providing effective compact way qualitatively model preferences outcomes i.e. decisions combinatorial structure 3 7 wish incorporate ethical moral norms based constraints decision context means subjective preferences decision makers source information consider 1 8 indeed depending context may consider specific ethical principles derived appropriate ethical theory various laws norms preferences important preferences ethical principles conflict principles override subjective preferences decision maker therefore essential well founded techniques evaluate whether preferences compatible set ethical principles measure much preferences deviate ethical principles	positive	0
multi-task learning with multi-view attention for answer selection and knowledge base question answering	answer selection knowledge base question answering kbqa two important tasks question answering qa systems existing methods solve two tasks separately requires large number repetitive work neglects rich correlation information tasks paper tackle answer selection kbqa tasks simultaneously via multi-task learning mtl motivated following motivations first answer selection kbqa regarded ranking problem one text-level knowledge-level second two tasks benefit answer selection incorporate external knowledge knowledge base kb kbqa improved learning contextual information answer selection fulfill goal jointly learning two tasks propose novel multi-task learning scheme utilizes multi-view attention learned various perspectives enable tasks interact well learn comprehensive sentence representations experiments conducted several real-world datasets demonstrate effectiveness proposed method performance answer selection kbqa improved also multi-view attention scheme proved effective assembling attentive information different representational perspectives	negative	6.826094776246464
cake, death, and trolleys: dilemmas as benchmarks of ethical decision-making	artificial intelligence ai systems becoming part lives societies decisions systems make us need ensure decisions make positive individual societal ethical impact estimate good system making ethical decisions benchmarking used evaluate good machine process performs respect industry bests paper argue ethical dilemmas used benchmarks estimating ethical performance autonomous system advocate open source repository dilemmas maintained present prototype repository available https //imdb uib.no/dilemmaz/articles/all1	positive	0
 rationalization: a neural machine translation approach to generating natural language explanations	introduce \em ai rationalization approach generating explanations autonomous system behavior human performed behavior describe rationalization technique uses neural machine translation translate internal state-action representations autonomous agent natural language evaluate technique frogger game environment training autonomous game playing agent rationalize action choices using natural language natural language training corpus collected human players thinking loud play game motivate use rationalization approach explanation generation show results two experiments evaluating effectiveness rationalization results evaluations show neural machine translation able accurately generate rationalizations describe agent behavior rationalizations satisfying humans alternative methods explanation	positive	0
data driven platform for organizing scientific articles relevant to biomimicry	life earth presents elegant solutions many challenges innovators entrepreneurs across disciplines face every day facilitate innovations inspired nature emerging need systems bring relevant biological information application-oriented market paper discuss approach assembling system uses machine learning techniques assess scientific article 's potential usefulness innovators classifies articles way helps innovators find information relevant challenges attempting solve	positive	0
 inverse norm conflict resolution	previous work provided `` norm conflict resolution '' algorithm allowing agents stochastic domains represented markov decision processes `` maximally satisfy '' set moral social norms norms represented statements linear temporal logic ltl required agent designer provide weights specifying relative importance norm paper propose `` inverse norm conflict resolution '' algorithm learning weights demonstration approach minimizes cost function based relative entropy policy encoding observed behavior policy representing optimal norm-following behavior demonstrate effectiveness algorithm simple gridworld domain	positive	0
