partially generative neural networks for gang crime classification with partial information	1 million homicides robberies aggravated assaults occur united states year crimes often classified different types based circumstances surrounding crime e.g. domestic violence gang-related despite recent technological advances ai machine learning additional classification tasks still done manually specially trained police officers paper provide first attempt develop automatic system classifying crimes particular study question classifying whether given violent crime gang-related introduce novel partially generative neural networks pgnn able accurately classify gang-related crimes full information available partial information pgnn first generative-classification model enables work features test examples missing using crime event dataset los angeles covering 2014-2016 experimentally show pgnn outperforms typically used classifiers problem classifying gang-related violent crimes	positive	0
transparency and explanation in deep reinforcement learning neural networks	autonomous ai systems entering human society near future provide services work alongside humans systems accepted trusted users able understand reasoning process system i.e system transparent system transparency enables humans form coherent explanations system 's decisions actions transparency important user trust also software debugging certification recent years deep neural networks made great advances multiple application areas however deep neural networks opaque paper report work transparency deep reinforcement learning networks drln networks extremely successful accurately learning action control image input domains atari games paper propose novel general method incorporates explicit object recognition processing deep reinforcement learning models b forms basis development `` object saliency maps '' provide visualization internal states drlns thus enabling formation explanations c incorporated existing deep reinforcement learning framework present computational results human experiments evaluate approach	positive	0
 a framework for grounding the moral status of intelligent machines	propose framework derived moral theory assessing moral status intelligent machines using framework claim current foreseeable intelligent machines approximately much moral status plants trees environmental entities claim raises question obligations could moral agent e.g. normal adult human toward intelligent machine propose threshold moral obligation `` functional morality '' wallach allen 20 upper limit obligations exceed upper limit obligations toward plants trees environmental entities	positive	0
what’s up with privacy? : user preferences and privacy concerns in intelligent personal assistants	recent breakthroughs artificial intelligence ai allowed individuals rely automated systems variety reasons systems currently popular voice-enabled systems like echo amazon home google also called intelligent personal assistants ipas though rising concerns privacy ethical implications users ipas seem continue using systems aim investigate extent users concerned privacy handling concerns using ipas utilizing reviews posted online along responses survey paper provides set insights detected markers related user interests privacy challenges insights suggest users systems irrespective concerns privacy generally positive terms utilizing ipas everyday lives however significant percentage users concerned privacy take actions address related concerns percentage users expressed privacy concerns learned `` always listening '' feature devices concern privacy increased	positive	0
sign-full random projections	method 1-bit “ sign-sign ” random projections popular tool efficient search machine learning large datasets given two d-dim data vectors u v ∈ ℝd one generate x ∑i=1d uiri ∑i=1d viri ri ∼ n 0 1 iid one estimate cosine similarity ρ sgn x sgn paper study series estimators “ sign-full ” random projections first prove e sgn x √2/πρ provides estimator ρ. interestingly estimator substantially improved normalizing y. study estimators based e y−1x≥0 y+1x 0 normalized version analyze theoretical limit using mle conclude among proposed estimators single estimator achieve close theoretical optimal asymptotic variance entire range ρ. hand estimators combined achieve variance close mle applications near neighbor search duplicate detection knn-classification etc training data first transformed via random projections signs projected data points stored i.e. sgn x original training data discarded new data point arrives apply random projections necessarily need quantize projected data i.e. 1-bit therefore sign-full random projections practically useful gain essentially comes additional cost	negative	6.589546399191022
backbone cannot be trained at once: rolling back to pre-trained network for person re-identification	person re-identification reid task shortage trainable dataset common utilize fine-tuning method using classification network pre-trained large dataset however relatively difficult sufficiently finetune low-level layers network due gradient vanishing problem work propose novel fine-tuning strategy allows low-level layers sufficiently trained rolling back weights high-level layers initial pre-trained weights strategy alleviates problem gradient vanishing low-level layers robustly trains low-level layers fit reid dataset thereby increasing performance reid tasks improved performance proposed strategy validated via several experiments furthermore without addons pose estimation segmentation strategy exhibits state-of-the-art performance using vanilla deep convolutional neural network architecture	negative	6.907476299267728
non-discriminatory machine learning through convex fairness criteria	introduce novel technique achieve non-discrimination machine learning without sacrificing convexity probabilistic interpretation also propose new notion fairness machine learning called weighted proportional fairness show technique satisfies subjective fairness criterion	positive	0
contextualized non-local neural networks for sequence learning	recently large number neural mechanisms models proposed sequence learning selfattention exemplified transformer model graph neural networks gnns attracted much attention paper propose approach combines draws complementary strengths two methods specifically propose contextualized non-local neural networks cn3 dynamically construct task-specific structure sentence leverage rich local dependencies within particular neighbourhood	negative	7.25611684913747
legible normativity for ai alignment: the value of silly rules	become commonplace assert autonomous agents built follow human rules behavior -- social norms laws human laws norms complex culturally varied systems many cases agents learn rules requires autonomous agents models human rule systems work make reliable predictions rules paper contribute building models analyzing overlooked distinction important rules call silly rules -- rules discernible direct impact welfare show silly rules render normative system robust adaptable response shocks perceived stability make normativity legible humans increase legibility ai systems well ai systems integrate human normative systems suggest may important models include representations silly rules	positive	0
unsupervised domain adaptation by matching distributions based on the maximum mean discrepancy via unilateral transformations	propose simple yet effective method unsupervised domain adaptation training test distributions different standard supervised learning methods perform poorly semi-supervised domain adaptation methods developed case labeled data target domain available however target data often unlabeled practice therefore unsupervised domain adaptation require labels target data receiving lot attention proposed method minimizes discrepancy source target distributions input features transforming feature space source domain since unilateral transformations transfer knowledge source domain target one without reducing dimensionality proposed method effectively perform domain adaptation without losing information transfered proposed method assumed transformed features original features differ small residual preserve relationship features labels transformation learned aligning higher-order moments source target feature distributions based maximum mean discrepancy enables compare two distributions without density estimation transformation found learn supervised models using transformed source data labels use two real-world datasets demonstrate experimentally proposed method achieves better classification performance existing methods unsupervised domain adaptation	negative	7.4990405630960595
algorithmic greenlining: an approach to increase diversity	contexts college admissions hiring image search decision-makers often aspire formulate selection criteria yield high-quality diverse results however simultaneously optimizing quality diversity challenging especially decision-maker know true quality criterion instead must rely heuristics intuition introduce algorithmic framework takes input user 's selection criterion may yield high-quality homogeneous results using application-specific notion substitutability algorithms suggest similar criteria diverse results spirit statistical demographic parity instance given image search query `` chairman '' suggests alternative queries similar gender-diverse `` chairperson '' context college admissions apply algorithm dataset students applications rediscover texas 's `` top 10 rule '' input criterion act score cutoff output class rank cutoff automatically accepting students top decile graduating class historically policy effective admitting students perform well college come diverse backgrounds complement empirical analysis learning-theoretic guarantees estimating true diversity criterion based historical data	positive	0
the heart of the matter: patient autonomy as a model for the wellbeing of technology users	draw concepts medical ethics consider computer science ai particular develop critical tools thinking concretely technology 's impact wellbeing people use focus patient autonomy -- -the ability set terms one 's encounter medicine -- -and mediating concepts informed consent decisional capacity enable doctors honor patients autonomy messy non-ideal circumstances comparative study organized around fictional case study heart patient cardiac implants using case study identify points overlap difference medical ethics technology ethics leverage discussion intertwined scenario offer initial practical suggestions adapt concepts decisional capacity informed consent discussion technology design	positive	0
towards optimal fine grained retrieval via decorrelated centralized loss with normalize-scale layer	recent advances fine-grained image retrieval prefer learning convolutional neural network cnn specific fullyconnect layer designed loss function discriminative feature representation essentially loss establish robust metric efficiently distinguish high-dimensional features within outside fine-grained categories end existing loss functions defected two aspects feature relationship encoded inside training batch local scope leads low accuracy b error established mean square needs pairwise distance computation training set results low efficiency paper propose novel metric learning scheme termed normalize-scale layer decorrelated global centralized ranking loss achieves extremely efficient discriminative learning i.e. 5× speedup triplet loss 12 recall boost cars196 method originates classic softmax loss global structure directly optimize distance metric well inter/intra class distance tackle issue hypersphere layer global centralized ranking loss pairwise decorrelated learning particular first propose normalize-scale layer eliminate gap metric distance measuring distance retrieval dot product dimension reduction classification second relationship features encoded global centralized ranking loss targets optimizing metric distance globally accelerating learning procedure finally centers decorrelated gram-schmidt process leading extreme efficiency 20 epochs training procedure discriminability feature learning conducted quantitative evaluations two fine-grained retrieval benchmark superior performance demonstrates merits proposed approach state-of-the-arts	negative	8.061665409710258
(when) can ai bots lie?	ability ai agent build mental models open pathways manipulating exploiting human hopes achieving greater good fact behavior necessarily require malicious intent rather borne cooperative scenarios also beyond scope misinterpretation intents case value alignment problems thus effectively engineered desired i.e algorithms exist optimize behavior models misspecified misused techniques pose several unresolved ethical moral questions regards design autonomy paper illustrate issues teaming scenario investigate perceived participants thought experiment finally end discussion moral implications behavior perspective doctor-patient relationship	positive	0
regulating autonomous vehicles: a policy proposal	widespread deployment testing autonomous vehicles real-world environments raises key questions systems regulated much current debate presupposes regulatory system currently use regular vehicles also appropriate semi- fully-autonomous ones opposition first argue serious challenges regulating autonomous vehicles using current approaches due nature autonomous capabilities connections operational domains also systems tasks surrounding uncertainties instead argue vehicles autonomous capabilities similar key respects drugs medical inter-ventions thus propose `` first principles '' basis dynamic regulatory system staged approvals monitoring analogous system used u.s. food drug administration provide details operation potential system conclude characterizing benefits costs plausibility	positive	0
deep convolutional sum-product networks	give conditions convolutional neural networks cnns define valid sum-product networks spns one subclass called convolutional spns cspns implemented using tensors also suffer shallow fortunately tensors augmented maintaining valid spns yields larger subclass cnns call deep convolutional spns dcspns convolutional sum-pooling layers form rich directed acyclic graph structures one salient feature dcspns rigorous probabilistic model exploit multiple kinds probabilistic reasoning including marginal inference probable explanation mpe inference allows alternative method learning dcspns using vectorized differentiable mpe plays similar role generator generative adversarial networks gans image sampling yet another application demonstrating robustness dcspns preliminary results image sampling encouraging since dcspn sampled images exhibit variability experiments image completion show dcspns significantly outperform competing methods achieving several state-of-the-art mean squared error mse scores left-completion bottom-completion benchmark datasets	negative	5.896870679047424
scale invariant fully convolutional network: detecting hands efficiently	existing hand detection methods usually follow pipeline multiple stages high computation cost i.e. feature extraction region proposal bounding box regression additional layers rotated region detection paper propose new scale invariant fully convolutional network sifcn trained end-to-end fashion detect hands efficiently specifically merge feature maps high low layers iterative way handles different scales hands better less time overhead comparing concatenating simply moreover develop complementary weighted fusion cwf block make full use distinctive features among multiple layers achieve scale invariance deal rotated hand detection present rotation map get rid complex rotation derotation layers besides design multi-scale loss scheme accelerate training process significantly adding supervision intermediate layers network compared state-of-the-art methods algorithm shows comparable accuracy runs 4.23 times faster speed viva dataset achieves better average precision oxford hand detection dataset speed 62.5 fps	negative	7.381643122411333
human-in-the-loop feature selection	feature selection crucial step conception machine learning models often performed via datadriven approaches overlook possibility tapping human decision-making model ’ designers users present human-in-the-loop framework interacts domain experts collecting feedback regarding variables samples evaluate relevant task hand information modeled via reinforcement learning derive per-example feature selection method tries minimize model ’ loss function focusing pertinent variables human perspective report results proof-of-concept image classification dataset real-world risk classification task model successfully incorporated feedback experts improve accuracy	negative	8.117082754324656
perceptions of domestic robots?? normative behavior across cultures	domestic service robots become common widespread must programmed efficiently accomplish tasks aligning actions relevant norms first step equip domestic robots normative reasoning competence understanding norms people apply behavior robots specific social contexts end conducted online survey chinese united states participants asked select preferred normative action domestic service robot take number scenarios paper makes multiple contributions extensive survey first collect data attitudes people normative behavior domestic robots b across cultures c study relative priorities among norms domain present findings discuss implications building computational models robot normative reasoning	positive	0
inferring work task automatability from ai expert evidence	despite growing alarm machine learning technologies automating jobs little good evidence activities automated using technologies contribute first dataset kind surveying 150 top academics industry experts machine learning robotics ai receiving 4,500 ratings automatable specific tasks today present probabilistic machine learning model learn patterns connecting expert estimates task automatability skills knowledge abilities required perform tasks model infers automatability 2,000 work activities show automation differs across types activities types occupations sensitivity analysis identifies specific skills knowledge abilities activities drive higher lower automatability provide quantitative evidence perceived automatable using state-of-the-art machine learning technology consider societal impacts results task-level approaches	positive	0
human-ai learning performance in multi-armed bandits	people frequently face challenging decision-making problems outcomes uncertain unknown artificial intelligence ai algorithms exist outperform humans learning tasks thus opportunity ai agents assist people learning tasks effectively work use multi-armed bandit controlled setting explore direction pair humans selection agents observe well human-agent team performs find team performance beat human agent performance isolation interestingly also find agent 's performance isolation necessarily correlate human-agent team 's performance drop agent performance lead disproportionately large drop team performance settings even improve team performance pairing human agent performs slightly better make perform much better pairing agent performs make perform much worse results suggest people different exploration strategies might perform better agents match strategy overall optimizing human-agent team performance requires going beyond optimizing agent performance understanding agent 's suggestions influence human decision-making	positive	0
adversarial framing for image and video classification	neural networks prone adversarial attacks general attacks deteriorate quality input either slightly modifying pixels occluding patch paper propose method keeps image unchanged adds adversarial framing border image show empirically method able successfully attack state-of-theart methods image video classification problems notably proposed method results universal attack fast test time source code found github.com/zajaczajac/adv_framing	negative	5.518860280426452
learning non-uniform hypergraph for multi-object tracking	majority multi-object tracking mot algorithms based tracking-by-detection scheme use higher order dependencies among objects tracklets makes less effective handling complex scenarios work present new near-online mot algorithm based non-uniform hypergraph model different degrees dependencies among tracklets unified objective nodes hypergraph correspond tracklets hyperedges different degrees encode various kinds dependencies among specifically instead setting weights hyperedges different degrees empirically learned automatically using structural support vector machine algorithm ssvm several experiments carried various challenging datasets i.e. pets09 parkinglot sequence subwayface mot16 benchmark demonstrate method achieves favorable performance state-of-the-art mot methods	negative	7.81727691902779
rsa: byzantine-robust stochastic aggregation methods for distributed learning from heterogeneous datasets	paper propose class robust stochastic subgradient methods distributed learning heterogeneous datasets presence unknown number byzantine workers byzantine workers learning process may send arbitrary incorrect messages master due data corruptions communication failures malicious attacks consequently bias learned model key proposed methods regularization term incorporated objective function robustify learning task mitigate negative effects byzantine attacks resultant subgradient-based algorithms termed byzantine-robust stochastic aggregation methods justifying acronym rsa used henceforth contrast existing algorithms rsa rely assumption data independent identically distributed i.i.d workers hence fits wider class applications theoretically show rsa converges near-optimal solution learning error dependent number byzantine workers ii convergence rate rsa byzantine attacks stochastic gradient descent method free byzantine attacks numerically experiments real dataset corroborate competitive performance rsa complexity reduction compared state-of-the-art alternatives	negative	8.001422648201697
 understanding convolutional networks with apple : automatic patch pattern labeling for explanation	1961 group established within ibm test systems programs released customer usage goal group assure ibm management program released would satisfactorily usable customer one step taken group develop monitor device would permit programmers record information handled cpu execution intent use recorded information analyze basic nature programs goal developing adequate tests system program another potential use device measurement hardware performance disk-arm motion microsecond levels	positive	0
spatial and temporal mutual promotion for video-based person re-identification	video-based person re-identification crucial task matching video sequences person across multiple camera views generally features directly extracted single frame suffer occlusion blur illumination posture changes leads false activation missing activation regions corrupts appearance motion representation explore abundant spatial-temporal information video sequences key solve problem end propose refining recurrent unit rru recovers missing parts suppresses noisy parts current frame ’ features referring historical frames rru quality frame ’ appearance representation improved use spatial-temporal clues integration module stim mine spatial-temporal information upgraded features meanwhile multilevel training objective used enhance capability rru stim cooperation modules spatial temporal features mutually promote final spatial-temporal feature representation discriminative robust extensive experiments conducted three challenging datasets i.e. ilids-vid prid-2011 mars experimental results demonstrate approach outperforms existing state-of-the-art methods video-based person re-identification ilids-vid mars achieves favorable results prid-2011	negative	8.12710190739017
taking advantage of multitask learning for fair classification	central goal algorithmic fairness reduce bias automated decision making unavoidable tension exists accuracy gains obtained using sensitive information part statistical model commitment protect characteristics often due biases present data using sensitive information functional form classifier improves classification accuracy paper show possible get best worlds optimize model accuracy fairness without explicitly using sensitive feature functional form model thereby treating different individuals equally method based two key ideas one hand propose use multitask learning mtl enhanced fairness constraints jointly learn group specific classifiers leverage information sensitive groups hand since learning group specific models might permitted propose first predict sensitive features learning method use predicted sensitive feature train mtl fairness constraints enables us tackle fairness three-pronged approach increasing accuracy group enforcing measures fairness training protecting sensitive information testing experimental results two real datasets support proposal showing substantial improvements accuracy fairness	positive	0
